{
  "schema_version": "0.1.0",
  "kind": "intent-contract",
  "intent_id": "INTENT-0001",
  "space_id": "mingos-project",
  "original_expression": "不要让探讨一直在，而是让这件事发生，然后过程调整",
  "current_understanding": "建立可运行、可验证、可持续交接的 MingOS 公共内核，而不是继续扩写概念文档",
  "goals": [
    "建立跨空间对象的机器可验证 Schema",
    "建立无证据不得完成的内核不变量",
    "让 MingOS 项目自身成为第一个运行案例"
  ],
  "non_goals": [
    "本轮不开发完整 UI",
    "本轮不迁移 Family-Space 业务代码",
    "本轮不接入真实用户或生产环境"
  ],
  "constraints": [
    "保持 Foundation、MingOS、Space 三层边界",
    "优先采用可替换技术实现",
    "所有示例必须通过自动验证"
  ],
  "definition_of_done": [
    "Schema 可被自动加载并验证",
    "示例空间通过跨对象不变量检查",
    "CI 在 pull request 和 main push 上运行",
    "下一位 Agent 可只读仓库文件继续"
  ],
  "human_decisions": [
    "是否合并首个 Draft PR",
    "M1 是否优先实现 CLI 还是先做双 Agent 连续性实验"
  ],
  "allowed_capabilities": ["github-read", "github-write-branch", "local-validation"],
  "risk_level": "low",
  "status": "active",
  "next_action": "审阅并合并 M0 bootstrap Draft PR",
  "version": 1
}
